{
  "$schema": "https://json-schema.org/draft/2020-12/schema",
  "$id": "https://leaduxai.id/schemas/content-strategist/content-opportunity.schema.json",
  "title": "LeadUX Content Opportunity",
  "type": "object",
  "required": ["content_opportunity_id","title","objective","research_lineage","dimensions","confidence","portfolio_candidate"],
  "properties": {
    "content_opportunity_id":{"type":"string","minLength":1},
    "title":{"type":"string","minLength":1},
    "target_segment":{"type":["string","null"]},
    "objective":{"type":"string","minLength":1},
    "pillar_id":{"type":["string","null"]},
    "topic":{"type":["string","null"]},
    "angle":{"type":["string","null"]},
    "why_now":{"type":["string","null"]},
    "recommended_formats":{"type":"array","items":{"type":"string"}},
    "research_lineage":{"type":"object","required":["claim_ids","insight_ids","market_opportunity_ids","voc_ids","signal_ids","content_footprint_ids"],"properties":{"claim_ids":{"type":"array","items":{"type":"string"}},"insight_ids":{"type":"array","items":{"type":"string"}},"market_opportunity_ids":{"type":"array","items":{"type":"string"}},"voc_ids":{"type":"array","items":{"type":"string"}},"signal_ids":{"type":"array","items":{"type":"string"}},"performance_pattern_ids":{"type":"array","items":{"type":"string"}},"content_footprint_ids":{"type":"array","items":{"type":"string"}}},"additionalProperties":false},
    "dimensions":{"type":"object","properties":{"audience_evidence":{"enum":["HIGH","MEDIUM","LOW","UNKNOWN"]},"business_relevance":{"enum":["HIGH","MEDIUM","LOW","UNKNOWN"]},"competitive_whitespace":{"enum":["HIGH","MEDIUM","LOW","UNKNOWN"]},"freshness":{"enum":["HIGH","MEDIUM","LOW","UNKNOWN"]},"historical_fit":{"enum":["HIGH","MEDIUM","LOW","UNKNOWN"]},"differentiation":{"enum":["HIGH","MEDIUM","LOW","UNKNOWN"]},"production_feasibility":{"enum":["HIGH","MEDIUM","LOW","UNKNOWN"]},"evidence_confidence":{"enum":["HIGH","MEDIUM","LOW","UNKNOWN"]}},"additionalProperties":false},
    "aggregate_score":{"type":["number","null"],"minimum":0,"maximum":100},
    "scoring_version":{"type":["string","null"]},
    "missing_dimensions":{"type":"array","items":{"type":"string"}},
    "contradicting_ids":{"type":"array","items":{"type":"string"}},
    "risks":{"type":"array","items":{"type":"string"}},
    "unknowns":{"type":"array","items":{"type":"string"}},
    "confidence":{"enum":["HIGH","MEDIUM","LOW"]},
    "validation_step":{"type":["string","null"]},
    "portfolio_candidate":{"enum":["core","responsive","experiment","deferred","rejected"]},
    "duplicate_risk":{"enum":["HIGH","MEDIUM","LOW","UNKNOWN"]},
    "duplicate_matches":{"type":"array","items":{"type":"object"}},
    "score_coverage":{"type":["number","null"],"minimum":0,"maximum":1}
  },
  "additionalProperties": true
}
