{
  "content_opportunity_id": "cop_demo_001",
  "title": "Explain the hidden cost of setup complexity",
  "target_segment": "SMB automation buyers",
  "objective": "authority",
  "pillar_id": "pillar_001",
  "topic": "automation setup complexity",
  "angle": "Show where complexity actually comes from and when AI helps",
  "why_now": "Recent product signal plus VOC pain",
  "recommended_formats": ["short-video","telegram-post"],
  "research_lineage": {"claim_ids":["claim_demo_001"],"insight_ids":["ins_demo_001"],"market_opportunity_ids":[],"voc_ids":["voc_demo_001"],"signal_ids":["sig_demo_001"],"content_footprint_ids":["cf_demo_001"],"performance_pattern_ids":[]},
  "dimensions": {"audience_evidence":"HIGH","business_relevance":"HIGH","competitive_whitespace":"MEDIUM","freshness":"HIGH","historical_fit":"UNKNOWN","differentiation":"HIGH","production_feasibility":"HIGH","evidence_confidence":"MEDIUM"},
  "aggregate_score": null,
  "score_coverage": null,
  "scoring_version": "v0.2-default",
  "missing_dimensions": ["historical_fit"],
  "contradicting_ids": [],
  "risks": [],
  "unknowns": ["No first-party performance history yet"],
  "confidence": "MEDIUM",
  "validation_step": "Publish two variants and compare qualified responses",
  "portfolio_candidate": "experiment",
  "duplicate_risk": "UNKNOWN",
  "duplicate_matches": []
}
